[
  {
    "schema_version": "trigger-gold-standard-v2",
    "case_id": "snomed_syn_001",
    "lexical_tier": "snomed_ct_synonym",
    "patient_case": "Patient with AF, heart failure with reduced ejection fraction, normal epicardial coronary arteries and persistent anginal-equivalent symptoms.",
    "intended_node_ids": [
      "input_6c180966d76985e738fa",
      "input_55739003e983a5362060",
      "input_6c30e666810b81bf4e89",
      "input_46db42052a49a3e0f1c4"
    ],
    "intended_nodes": [
      {
        "node_id": "input_6c180966d76985e738fa",
        "mention": "AF",
        "entity_original": "AF",
        "context": "indication for ventricular pacing for high-degree AV block this includes patients with AF",
        "role": "ClinicalCondition",
        "annotation_status": "ANNOTATED_FROM_SOURCE",
        "entity_standardized_list": [
          {
            "entity_standardized_candidate": "Atrial fibrillation",
            "snomed_id": "49436004"
          }
        ],
        "logic_operators": [
          "PRESENT"
        ],
        "source_row_ids": [
          "table_rec_24_manual_1.4.json::table_0::row_14"
        ]
      },
      {
        "node_id": "input_55739003e983a5362060",
        "mention": "heart failure with reduced ejection fraction",
        "entity_original": "HFrEF",
        "context": "selected patients with HFrEF",
        "role": "ClinicalCondition",
        "annotation_status": "ANNOTATED_FROM_SOURCE",
        "entity_standardized_list": [
          {
            "entity_standardized_candidate": "Heart failure with reduced ejection fraction",
            "snomed_id": "703272007"
          }
        ],
        "logic_operators": [
          "PRESENT"
        ],
        "source_row_ids": [
          "table_rec_24_manual_1.4.json::table_0::row_4"
        ]
      },
      {
        "node_id": "input_6c30e666810b81bf4e89",
        "mention": "normal epicardial coronary arteries",
        "entity_original": "normal epicardial coronary arteries",
        "context": "normal or non-obstructive epicardial coronary arteries",
        "role": "ClinicalCondition",
        "annotation_status": "NEEDS_ANNOTATION",
        "entity_standardized_list": [
          {
            "entity_standardized_candidate": "",
            "snomed_id": ""
          }
        ],
        "logic_operators": [
          "PRESENT"
        ],
        "source_row_ids": [
          "table_rec_24_manual_1.4.json::table_0::row_3"
        ]
      },
      {
        "node_id": "input_46db42052a49a3e0f1c4",
        "mention": "persistent anginal-equivalent symptoms",
        "entity_original": "angina equivalent symptoms",
        "context": "persistent angina or equivalent symptoms",
        "role": "ClinicalCondition",
        "annotation_status": "ANNOTATED_FROM_SOURCE",
        "entity_standardized_list": [
          {
            "entity_standardized_candidate": "Anginal equivalent",
            "snomed_id": "565394081000119105"
          }
        ],
        "logic_operators": [
          "PRESENT"
        ],
        "source_row_ids": [
          "table_rec_24_manual_1.4.json::table_0::row_3"
        ]
      }
    ],
    "trigger_semantics": "A row is expected here when at least one intended input node occurs in that row. This is not a claim that every condition of the row is fulfilled.",
    "expected_triggered_row_ids": [
      "table_rec_24_manual_1.4.json::table_0::row_14",
      "table_rec_24_manual_1.4.json::table_0::row_3",
      "table_rec_24_manual_1.4.json::table_0::row_4"
    ],
    "triggered_rows": [
      {
        "row_id": "table_rec_24_manual_1.4.json::table_0::row_14",
        "file": "table_rec_24_manual_1.4.json",
        "table_id": 0,
        "row_index_zero_based": 14,
        "matched_node_ids": [
          "input_6c180966d76985e738fa"
        ]
      },
      {
        "row_id": "table_rec_24_manual_1.4.json::table_0::row_3",
        "file": "table_rec_24_manual_1.4.json",
        "table_id": 0,
        "row_index_zero_based": 3,
        "matched_node_ids": [
          "input_46db42052a49a3e0f1c4",
          "input_6c30e666810b81bf4e89"
        ]
      },
      {
        "row_id": "table_rec_24_manual_1.4.json::table_0::row_4",
        "file": "table_rec_24_manual_1.4.json",
        "table_id": 0,
        "row_index_zero_based": 4,
        "matched_node_ids": [
          "input_55739003e983a5362060"
        ]
      }
    ],
    "expected_fully_satisfied_row_ids": null,
    "lexical_provenance": {
      "mode": "snomed_ct_synonym",
      "terminology_source": "SNOMED CT US Edition",
      "terminology_view": "NCBO BioPortal (or NCBI MedGen where noted)",
      "concept_id": "49436004",
      "preferred_term": "Atrial fibrillation",
      "synonym_used": "AF",
      "canonical_concept_uri": "http://snomed.info/id/49436004",
      "snomed_browser_url": "https://browser.ihtsdotools.org/?perspective=full&conceptId1=49436004",
      "verification_url": "https://purl.bioontology.org/ontology/SNOMEDCT/49436004",
      "verified_on": "2026-08-01",
      "target_node_id": "input_6c180966d76985e738fa",
      "base_mention": "atrial fibrillation",
      "replacement_mention": "AF"
    },
    "derived_from_case_id": "near_063"
  },
  {
    "schema_version": "trigger-gold-standard-v2",
    "case_id": "snomed_syn_002",
    "lexical_tier": "snomed_ct_synonym",
    "patient_case": "Patient with cardiac failure, no current symptoms and overweight with a BMI of 29 kg/m².",
    "intended_node_ids": [
      "input_5812d323f9927cd41746",
      "input_e35a22a091e1ca1ca67d",
      "input_004d40b9acf8c220a4ad"
    ],
    "intended_nodes": [
      {
        "node_id": "input_5812d323f9927cd41746",
        "mention": "cardiac failure",
        "entity_original": "HF",
        "context": "",
        "role": "ClinicalCondition",
        "annotation_status": "ANNOTATED_FROM_SOURCE",
        "entity_standardized_list": [
          {
            "entity_standardized_candidate": "Heart failure",
            "snomed_id": "84114007"
          }
        ],
        "logic_operators": [
          "PRESENT"
        ],
        "source_row_ids": [
          "table_rec_24_manual_1.4.json::table_0::row_10"
        ]
      },
      {
        "node_id": "input_e35a22a091e1ca1ca67d",
        "mention": "no current symptoms",
        "entity_original": "asymptomatic individuals",
        "context": "",
        "role": "ClinicalCondition",
        "annotation_status": "ANNOTATED_FROM_SOURCE",
        "entity_standardized_list": [
          {
            "entity_standardized_candidate": "Asymptomatic",
            "snomed_id": "84387000"
          }
        ],
        "logic_operators": [
          "PRESENT"
        ],
        "source_row_ids": [
          "table_rec_27_manual_1.4.json::table_0::row_0",
          "table_rec_27_manual_1.4.json::table_0::row_1",
          "table_rec_27_manual_1.4.json::table_0::row_2",
          "table_rec_27_manual_1.4.json::table_0::row_3"
        ]
      },
      {
        "node_id": "input_004d40b9acf8c220a4ad",
        "mention": "overweight with a BMI of 29 kg/m²",
        "entity_original": "overweight",
        "context": "(BMI ≥27 kg/m2)",
        "role": "ClinicalCondition",
        "annotation_status": "ANNOTATED_FROM_SOURCE",
        "entity_standardized_list": [
          {
            "entity_standardized_candidate": "Overweight",
            "snomed_id": "238131007"
          }
        ],
        "logic_operators": [
          "PRESENT"
        ],
        "source_row_ids": [
          "table_rec_19_manual_1.4.json::table_0::row_2"
        ]
      }
    ],
    "trigger_semantics": "A row is expected here when at least one intended input node occurs in that row. This is not a claim that every condition of the row is fulfilled.",
    "expected_triggered_row_ids": [
      "table_rec_19_manual_1.4.json::table_0::row_2",
      "table_rec_24_manual_1.4.json::table_0::row_10",
      "table_rec_27_manual_1.4.json::table_0::row_0",
      "table_rec_27_manual_1.4.json::table_0::row_1",
      "table_rec_27_manual_1.4.json::table_0::row_2",
      "table_rec_27_manual_1.4.json::table_0::row_3"
    ],
    "triggered_rows": [
      {
        "row_id": "table_rec_19_manual_1.4.json::table_0::row_2",
        "file": "table_rec_19_manual_1.4.json",
        "table_id": 0,
        "row_index_zero_based": 2,
        "matched_node_ids": [
          "input_004d40b9acf8c220a4ad"
        ]
      },
      {
        "row_id": "table_rec_24_manual_1.4.json::table_0::row_10",
        "file": "table_rec_24_manual_1.4.json",
        "table_id": 0,
        "row_index_zero_based": 10,
        "matched_node_ids": [
          "input_5812d323f9927cd41746"
        ]
      },
      {
        "row_id": "table_rec_27_manual_1.4.json::table_0::row_0",
        "file": "table_rec_27_manual_1.4.json",
        "table_id": 0,
        "row_index_zero_based": 0,
        "matched_node_ids": [
          "input_e35a22a091e1ca1ca67d"
        ]
      },
      {
        "row_id": "table_rec_27_manual_1.4.json::table_0::row_1",
        "file": "table_rec_27_manual_1.4.json",
        "table_id": 0,
        "row_index_zero_based": 1,
        "matched_node_ids": [
          "input_e35a22a091e1ca1ca67d"
        ]
      },
      {
        "row_id": "table_rec_27_manual_1.4.json::table_0::row_2",
        "file": "table_rec_27_manual_1.4.json",
        "table_id": 0,
        "row_index_zero_based": 2,
        "matched_node_ids": [
          "input_e35a22a091e1ca1ca67d"
        ]
      },
      {
        "row_id": "table_rec_27_manual_1.4.json::table_0::row_3",
        "file": "table_rec_27_manual_1.4.json",
        "table_id": 0,
        "row_index_zero_based": 3,
        "matched_node_ids": [
          "input_e35a22a091e1ca1ca67d"
        ]
      }
    ],
    "expected_fully_satisfied_row_ids": null,
    "lexical_provenance": {
      "mode": "snomed_ct_synonym",
      "terminology_source": "SNOMED CT US Edition",